{
  "$schema": "https://github.com/vedantmgoyal9/vedantmgoyal9/raw/main/WinGetAutomation/schema.json",
  "PackageIdentifier": "Wondershare.UBackit",
  "Source": [
    {
      "InvokeType": "RestMethod",
      "Uri": "https://cbs.wondershare.com/go.php?m=upgrade_info&pid=8767&version=1.0.0.0",
      "Method": "Get",
      "Headers": {},
      "Body": "",
      "UserAgent": ""
    }
  ],
  "PostResponseScript": "$Response = $Response.Respone.WhatNews.FirstChild",
  "Update": {
    "InstallerUrls": "$InstUri.Replace('#version', $Response.Version)",
    "PackageVersion": "(.\\winget-pkgs-automation.exe gii --json \"$($Update.InstallerUrls)\" | ConvertFrom-Json).PackageVersion",
    "Locales": [
      {
        "Name": "en-us",
        "ReleaseNotes": "$Response.Text.'#cdata-section'"
      }
    ]
  },
  "AdditionalInfo": {
    "InstUri": "https://download.wondershare.com/cbs_down/ubackit_#version_full8767.exe",
    "ForceUpgrade": false
  },
  "PostUpgradeScript": "",
  "Skip": {
    "Skip?": false,
    "Reason": null
  }
}
