{
  "$schema": "https://github.com/vedantmgoyal9/vedantmgoyal9/raw/main/WinGetAutomation/schema.json",
  "PackageIdentifier": "RemNote.RemNote",
  "Source": [
    {
      "InvokeType": "RestMethod",
      "Uri": "https://download.remnote.io/latest.yml",
      "Method": "Get",
      "Headers": {},
      "Body": "",
      "UserAgent": ""
    }
  ],
  "PostResponseScript": "$Response = $Response | ConvertFrom-Yaml",
  "Update": {
    "PackageVersion": "$Response.version",
    "InstallerUrls": "'https://download.remnote.io/' + [System.Uri]::EscapeDataString($Response.path)",
    "ReleaseDate": "(Get-Date -Date $Response.releaseDate).ToString('yyyy-MM-dd')"
  },
  "AdditionalInfo": {
    "ForceUpgrade": false
  },
  "PostUpgradeScript": "",
  "Skip": {
    "Skip?": false,
    "Reason": null
  }
}
