{
  "$schema": "https://github.com/vedantmgoyal9/vedantmgoyal9/raw/main/WinGetAutomation/schema.json",
  "PackageIdentifier": "1MHz.Knotes",
  "Source": [
    {
      "InvokeType": "RestMethod",
      "Uri": "https://knotes2-release-cn.s3.amazonaws.com/win/latest.yml",
      "Method": "Get",
      "Headers": {},
      "Body": "",
      "UserAgent": ""
    }
  ],
  "PostResponseScript": "$Response = $Response | ConvertFrom-Yaml",
  "Update": {
    "PackageVersion": "$Response.version",
    "InstallerUrls": "@(\"$($InstallerUrl.Replace('#path', [System.Uri]::EscapeDataString($Response.path)))|x64|user\", \"$($InstallerUrl.Replace('#path', [System.Uri]::EscapeDataString($Response.path)))|x64|machine\")",
    "ReleaseDate": "(Get-Date -Date $Response.releaseDate).ToString('yyyy-MM-dd')"
  },
  "AdditionalInfo": {
    "ForceUpgrade": false,
    "InstallerUrl": "https://knotes2-release-cn.s3.amazonaws.com/win/#path"
  },
  "PostUpgradeScript": "",
  "Skip": {
    "Skip?": false,
    "Reason": null
  }
}
