{
  "$schema": "https://github.com/vedantmgoyal9/vedantmgoyal9/raw/main/WinGetAutomation/schema.json",
  "PackageIdentifier": "AtomixProductions.VirtualDJ",
  "Source": [
    {
      "InvokeType": "WebRequest",
      "Uri": "https://www.virtualdj.com/download/pc",
      "Method": "Head",
      "Headers": {},
      "Body": "",
      "UserAgent": ""
    }
  ],
  "PostResponseScript": "$Response = $Response.BaseResponse.RequestMessage.RequestUri.OriginalString",
  "Update": {
    "PackageVersion": "(.\\winget-pkgs-automation.exe gii --json \"$($Response)\" | ConvertFrom-Json).PackageVersion",
    "InstallerUrls": "$Response"
  },
  "AdditionalInfo": {
    "ForceUpgrade": false,
    "VersionRegex": "[0-9.]+",
    "InstallerRegex": ".(exe|msi|msix|appx)(bundle){0,1}$"
  },
  "PostUpgradeScript": "",
  "Skip": {
    "Skip?": false,
    "Reason": null
  }
}
