{
  "$schema": "https://github.com/vedantmgoyal9/vedantmgoyal9/raw/main/WinGetAutomation/schema.json",
  "PackageIdentifier": "Spotify.Spotify",
  "Source": [
    {
      "InvokeType": "WebRequest",
      "Uri": "https://download.scdn.co/SpotifyFullSetup.exe",
      "Method": "Head",
      "Headers": {},
      "Body": "",
      "UserAgent": ""
    }
  ],
  "PostResponseScript": "$Response = $Response.BaseResponse.RequestMessage.RequestUri.OriginalString",
  "Update": {
    "PackageVersion": "(.\\winget-pkgs-automation.exe gii --json \"$($Response)\" | ConvertFrom-Json).PackageVersion",
    "InstallerUrls": "$Response"
  },
  "AdditionalInfo": {
    "ForceUpgrade": false
  },
  "PostUpgradeScript": "",
  "Skip": {
    "Skip?": false,
    "Reason": null
  }
}
