{
  "$schema": "https://github.com/vedantmgoyal9/vedantmgoyal9/raw/main/WinGetAutomation/schema.json",
  "PackageIdentifier": "ByteDance.JianyingPro",
  "Source": [
    {
      "InvokeType": "RestMethod",
      "Uri": "https://lf3-beecdn.bytetos.com/obj/ies-fe-bee/bee_prod/biz_80/bee_prod_80_bee_publish_3563.json",
      "Method": "Get",
      "Headers": {},
      "Body": "",
      "UserAgent": ""
    }
  ],
  "PostResponseScript": "$Response = $Response.windows_download_pkg.channel_default",
  "Update": {
    "PackageVersion": "($Response | Select-String -Pattern $VersionRegex).Matches.Value.Replace('_', '.')",
    "InstallerUrls": "$Response"
  },
  "AdditionalInfo": {
    "ForceUpgrade": false,
    "VersionRegex": "(?<=_)[0-9_]+(?=_)",
    "InstallerRegex": ".exe$"
  },
  "PostUpgradeScript": "",
  "Skip": {
    "Skip?": false,
    "Reason": null
  }
}
