{
  "$schema": "https://github.com/vedantmgoyal9/vedantmgoyal9/raw/main/WinGetAutomation/schema.json",
  "PackageIdentifier": "Adobe.AdobeConnect",
  "Source": [
    {
      "InvokeType": "WebRequest",
      "Uri": "https://www.adobe.com/go/Connect11msi",
      "Method": "Get",
      "Headers": {},
      "Body": "",
      "UserAgent": ""
    }
  ],
  "PostResponseScript": "$Response = $Response.BaseResponse.RequestMessage.RequestUri.OriginalString",
  "Update": {
    "PackageVersion": "($Response | Select-String -Pattern $VersionRegex).Matches.Value",
    "InstallerUrls": "$Response"
  },
  "AdditionalInfo": {
    "ForceUpgrade": false,
    "VersionRegex": "[0-9.]+",
    "InstallerRegex": ".(exe|msi|msix|appx)(bundle){0,1}$"
  },
  "PostUpgradeScript": "",
  "Skip": {
    "Skip?": false,
    "Reason": null
  }
}
