{
  "$schema": "https://github.com/vedantmgoyal9/vedantmgoyal9/raw/main/WinGetAutomation/schema.json",
  "PackageIdentifier": "115.115",
  "Source": [
    {
      "InvokeType": "RestMethod",
      "Uri": "https://appversion.115.com/1/web/1.0/api/chrome",
      "Method": "Get",
      "Headers": {},
      "Body": "",
      "UserAgent": ""
    }
  ],
  "PostResponseScript": "$Response = $Response.data.window_115",
  "Update": {
    "PackageVersion": "$Response.version_code",
    "InstallerUrls": "$Response.version_url",
    "ReleaseDate": "[System.DateTimeOffset]::FromUnixTimeSeconds($Response.created_time).ToString('yyyy-MM-dd')"
  },
  "AdditionalInfo": {
    "ForceUpgrade": false
  },
  "PostUpgradeScript": "",
  "Skip": {
    "Skip?": false,
    "Reason": null
  }
}
